{
  "format": "uconf/0.1",

  "product": {
    "id": "rivian-r2-2026",
    "make": "Rivian",
    "model": "R2",
    "year": 2026,
    "body": "Midsize electric SUV",
    "market": "US",
    "currency": "USD",
    "data_as_of": "2026-08-31",
    "sources": [
      "Rivian press release 2026-03-11 (trims & pricing)",
      "Rivian configurator (rivian.com/configurations/builder/r2) via public config URLs",
      "Electrek 2026-05-15 (configurator options & pricing)",
      "InsideEVs 2026-05-15 (fully-loaded pricing)",
      "RivianTrackr buyer's guide (range-by-wheel data)",
      "CarBuzz 2026-08 (tow package pricing)"
    ],
    "disclaimer": "Independent buyer-side tool. Not affiliated with, endorsed by, or sponsored by Rivian or any manufacturer. Vehicle names and specifications are used nominatively to identify real products. Verify all pricing and eligibility with the seller and a tax professional before purchase.",
    "assembly": { "country": "US", "plant": "Normal, Illinois" },
    "delivery_order": ["Available now", "Spring 2026", "Late 2026", "2027"],
    "calibration": {
      "published_fully_loaded_performance": 62745,
      "note": "InsideEVs reports a fully-equipped Performance w/ Launch Package at $62,745. Use to calibrate estimated option prices as they firm up."
    }
  },

  "groups": [
    { "id": "build", "label": "Build", "select": "one", "required": true, "role": "base", "default": "build.performance" },
    { "id": "paint", "label": "Paint", "select": "one", "required": true, "default": "paint.esker_silver" },
    { "id": "wheels", "label": "Wheels", "select": "one", "required": true, "default": "wheels.lt21_as" },
    { "id": "interior", "label": "Interior", "select": "one", "required": true, "default": "interior.black_crater" },
    { "id": "towing", "label": "Towing", "select": "many", "required": false },
    { "id": "charging", "label": "Charging", "select": "many", "required": false }
  ],

  "options": [
    {
      "id": "build.performance",
      "group": "build",
      "label": "R2 Performance (Launch Package)",
      "vendor_code": "BLD-PRF2",
      "price": { "amount": 57990, "mode": "base", "confidence": "verified" },
      "effects": [
        { "spec": "drivetrain", "op": "set", "value": "Dual-motor AWD", "confidence": "verified" },
        { "spec": "hp", "op": "set", "value": 656, "confidence": "verified" },
        { "spec": "torque_lbft", "op": "set", "value": 609, "confidence": "verified" },
        { "spec": "zero_to_sixty_s", "op": "set", "value": 3.6, "confidence": "verified" },
        { "spec": "range_mi", "op": "set", "value": 330, "confidence": "verified" },
        { "spec": "adas", "op": "set", "value": "Autonomy+ hands-free, lifetime (Launch Package)", "confidence": "verified" }
      ],
      "delivery": { "window": "Available now" },
      "copy": {
        "short": "656 hp dual-motor AWD, 330 mi, 0-60 in 3.6s.",
        "long": "Launch Package bundles Autonomy+ (lifetime), the Tow Package, a Launch key fob, and access to Launch Green paint — for a limited time.",
        "value_note": "The bundle math matters: Autonomy+ and the Tow Package ride free here. If you wanted both anyway, the real gap to Premium shrinks well below the sticker gap."
      },
      "provenance": { "source": "Rivian press release 2026-03-11; Electrek 2026-05-15", "confidence": "verified" }
    },
    {
      "id": "build.premium",
      "group": "build",
      "label": "R2 Premium",
      "vendor_code": "BLD-PRM2",
      "price": { "amount": 53990, "mode": "base", "confidence": "verified" },
      "effects": [
        { "spec": "drivetrain", "op": "set", "value": "Dual-motor AWD", "confidence": "verified" },
        { "spec": "range_mi", "op": "set", "value": 330, "confidence": "verified" }
      ],
      "delivery": { "window": "Late 2026" },
      "copy": {
        "short": "Dual-motor AWD, 330 mi.",
        "value_note": "Power figure unpublished as of data_as_of. $4,000 under Performance, but no Launch Package bundle — price the extras you'd add back."
      },
      "provenance": { "source": "Rivian press release 2026-03-11", "confidence": "verified" }
    },
    {
      "id": "build.standard_rwd",
      "group": "build",
      "label": "R2 Standard RWD",
      "vendor_code": "BLD-STND2 / DTN-RWDS",
      "price": { "amount": 44990, "mode": "base", "confidence": "verified" },
      "effects": [
        { "spec": "drivetrain", "op": "set", "value": "RWD", "confidence": "verified" },
        { "spec": "range_mi", "op": "set", "value": 275, "confidence": "verified" },
        { "spec": "battery", "op": "set", "value": "Standard pack", "confidence": "verified" }
      ],
      "delivery": { "window": "2027" },
      "copy": {
        "short": "The $44,990 entry point. 275 mi.",
        "value_note": "The anchor price, not the value pick — $3,500 more buys 70 extra miles of range one trim up."
      },
      "provenance": { "source": "RivianTrackr buyer's guide; Rivian configurator", "confidence": "verified" }
    },
    {
      "id": "build.standard_rwd_lr",
      "group": "build",
      "label": "R2 Standard RWD Long Range",
      "vendor_code": "BLD-STND2 / BAT-L02",
      "price": { "amount": 48490, "mode": "base", "confidence": "verified" },
      "effects": [
        { "spec": "drivetrain", "op": "set", "value": "RWD", "confidence": "verified" },
        { "spec": "range_mi", "op": "set", "value": 345, "confidence": "verified" },
        { "spec": "battery", "op": "set", "value": "Long Range pack", "confidence": "verified" }
      ],
      "delivery": { "window": "2027" },
      "copy": {
        "short": "The range champion of the entire lineup: 345 mi.",
        "value_note": "The quiet winner. More range than the Performance for $9,500 less. If range is your constraint, the lineup's best answer is its second-cheapest trim."
      },
      "provenance": { "source": "RivianTrackr buyer's guide", "confidence": "verified" }
    },
    {
      "id": "build.standard_awd_lr",
      "group": "build",
      "label": "R2 Standard AWD Long Range",
      "vendor_code": "BLD-STND2 / DTN-AWD / BAT-L02",
      "price": { "amount": 51990, "mode": "base", "confidence": "verified" },
      "effects": [
        { "spec": "drivetrain", "op": "set", "value": "Dual-motor AWD", "confidence": "verified" },
        { "spec": "range_mi", "op": "set", "value": 330, "confidence": "verified" },
        { "spec": "battery", "op": "set", "value": "Long Range pack", "confidence": "verified" }
      ],
      "delivery": { "window": "2027" },
      "copy": { "short": "AWD with the Long Range pack. 330 mi." },
      "provenance": { "source": "RivianTrackr buyer's guide", "confidence": "verified" }
    },

    {
      "id": "paint.esker_silver",
      "group": "paint",
      "label": "Esker Silver",
      "vendor_code": "EXP-ESV",
      "price": { "amount": 0, "mode": "delta", "confidence": "verified" },
      "render": { "hex": "#B9BCBF", "mesh_target": "body_paint" },
      "copy": { "value_note": "The only no-cost color in the palette. Every other choice is $1,000+ of paint." },
      "provenance": { "source": "Electrek 2026-05-15", "confidence": "verified" }
    },
    {
      "id": "paint.glacier_white",
      "group": "paint",
      "label": "Glacier White",
      "price": { "amount": 1000, "mode": "delta", "confidence": "estimated", "note": "published range for non-silver colors is $1,000-$2,000; exact figure unverified" },
      "render": { "hex": "#EDEFEF", "mesh_target": "body_paint" },
      "provenance": { "source": "Jalopnik 2026-05-15 (color exists); price within Electrek's published range", "confidence": "estimated" }
    },
    {
      "id": "paint.catalina_blue",
      "group": "paint",
      "label": "Catalina Blue",
      "price": { "amount": 1000, "mode": "delta", "confidence": "estimated", "note": "published range $1,000-$2,000; exact figure unverified" },
      "render": { "hex": "#2E4E6B", "mesh_target": "body_paint" },
      "provenance": { "source": "Rivian press release imagery (color exists)", "confidence": "estimated" }
    },
    {
      "id": "paint.forest_green",
      "group": "paint",
      "label": "Forest Green",
      "vendor_code": "EXP-FGR",
      "price": { "amount": 1000, "mode": "delta", "confidence": "estimated", "note": "published range $1,000-$2,000; exact figure unverified" },
      "render": { "hex": "#2F4436", "mesh_target": "body_paint" },
      "delivery": { "window": "Late 2026" },
      "copy": { "value_note": "Choosing this color moves your delivery to late 2026 regardless of trim availability." },
      "provenance": { "source": "Jalopnik/InsideEVs 2026-05-15", "confidence": "verified" }
    },
    {
      "id": "paint.launch_green",
      "group": "paint",
      "label": "Launch Green",
      "price": { "amount": 1000, "mode": "delta", "confidence": "estimated", "note": "Launch Package exclusive; exact price unverified" },
      "render": { "hex": "#4A5D3A", "mesh_target": "body_paint" },
      "availability": { "selected": "build.performance" },
      "copy": { "value_note": "Launch Package exclusive — a scarcity play. If resale stories move you, exclusivity colors historically hold a small premium." },
      "provenance": { "source": "Electrek 2026-05-15 (exclusivity verified)", "confidence": "verified" }
    },
    {
      "id": "paint.borealis",
      "group": "paint",
      "label": "Borealis",
      "price": { "amount": 2000, "mode": "delta", "confidence": "estimated", "note": "top of published $1,000-$2,000 range; exact figure unverified" },
      "render": { "hex": "#4B3A6B", "mesh_target": "body_paint" },
      "availability": { "selected": "build.performance" },
      "delivery": { "window": "2027" },
      "copy": { "value_note": "Performance-only, and not until 2027. Two thousand dollars and a year of waiting, for purple. (A great purple, admittedly.)" },